{
  "schema_version": "veriformis.corpus-demand-matrix/v1",
  "last_reviewed": "2026-09-05",
  "collection_policy": {
    "scanner": "scripts/scan_corpus_metadata.py",
    "allowed_metadata": [
      "aggregate byte counts",
      "aggregate file and directory counts",
      "declared input suffix counts",
      "hidden, symlink, and inaccessible entry counts",
      "size-bucket counts"
    ],
    "prohibited_data": [
      "content-derived classifications",
      "content hashes",
      "file contents",
      "file names",
      "source paths",
      "timestamps",
      "uncommon undeclared extension names"
    ]
  },
  "inventory_observations": [
    {
      "aggregate": {
        "bundle_context_file_count": 0,
        "bundle_directory_count": 0,
        "directory_count": 23,
        "extensions": [
          {
            "declared_v1_input_suffix": true,
            "extension": ".csv",
            "family": "tabular",
            "file_count": 2,
            "total_bytes": 47
          },
          {
            "declared_v1_input_suffix": true,
            "extension": ".json",
            "family": "structured-data",
            "file_count": 6,
            "total_bytes": 15308
          },
          {
            "declared_v1_input_suffix": true,
            "extension": ".jsonl",
            "family": "structured-data",
            "file_count": 9,
            "total_bytes": 1412
          },
          {
            "declared_v1_input_suffix": true,
            "extension": ".md",
            "family": "markup",
            "file_count": 7,
            "total_bytes": 1268
          },
          {
            "declared_v1_input_suffix": true,
            "extension": ".pdf",
            "family": "portable-document",
            "file_count": 16,
            "total_bytes": 216493
          },
          {
            "declared_v1_input_suffix": true,
            "extension": ".py",
            "family": "source-code",
            "file_count": 4,
            "total_bytes": 421
          },
          {
            "declared_v1_input_suffix": true,
            "extension": ".txt",
            "family": "plain-text",
            "file_count": 5,
            "total_bytes": 277
          },
          {
            "declared_v1_input_suffix": false,
            "extension": "[undeclared-other]",
            "family": "undeclared-other",
            "file_count": 6,
            "total_bytes": 217201
          }
        ],
        "families": [
          {
            "family": "markup",
            "file_count": 7,
            "total_bytes": 1268
          },
          {
            "family": "plain-text",
            "file_count": 5,
            "total_bytes": 277
          },
          {
            "family": "portable-document",
            "file_count": 16,
            "total_bytes": 216493
          },
          {
            "family": "source-code",
            "file_count": 4,
            "total_bytes": 421
          },
          {
            "family": "structured-data",
            "file_count": 15,
            "total_bytes": 16720
          },
          {
            "family": "tabular",
            "file_count": 2,
            "total_bytes": 47
          },
          {
            "family": "undeclared-other",
            "file_count": 6,
            "total_bytes": 217201
          }
        ],
        "file_count": 55,
        "hidden_entry_count": 0,
        "inaccessible_entry_count": 0,
        "other_entry_count": 0,
        "size_buckets": [
          {
            "bucket": "zero",
            "file_count": 0,
            "total_bytes": 0
          },
          {
            "bucket": "1b_to_1kib",
            "file_count": 38,
            "total_bytes": 10314
          },
          {
            "bucket": "over_1kib_to_1mib",
            "file_count": 17,
            "total_bytes": 442113
          },
          {
            "bucket": "over_1mib_to_100mib",
            "file_count": 0,
            "total_bytes": 0
          },
          {
            "bucket": "over_100mib",
            "file_count": 0,
            "total_bytes": 0
          }
        ],
        "symlink_count": 0,
        "total_bytes": 452427
      },
      "evidence_grade": "test-verified",
      "limitations": [
        "Suffix classification does not prove that a file is a user source or that parsing succeeds.",
        "Counts establish the observed root's composition, not customer-corpus prevalence or product demand.",
        "Undeclared suffixes are combined to avoid disclosing uncommon extension names.",
        "Symlink targets and file content are never followed or read."
      ],
      "observation_scope": "filesystem-metadata-only",
      "portability": "repository-tracked",
      "privacy": {
        "content_hashes_emitted": false,
        "file_content_read": false,
        "file_names_emitted": false,
        "source_paths_emitted": false,
        "timestamps_emitted": false,
        "undeclared_extensions_emitted": false
      },
      "schema_version": "veriformis.corpus-metadata-aggregate/v1",
      "source_id": "repository-test-fixtures"
    },
    {
      "schema_version": "veriformis.corpus-metadata-aggregate/v1",
      "source_id": "retained-gui-observations",
      "evidence_grade": "recorded-local",
      "portability": "local-only",
      "observation_scope": "filesystem-metadata-only",
      "aggregate": {
        "file_count": 89,
        "directory_count": 78,
        "total_bytes": 2995574,
        "symlink_count": 0,
        "other_entry_count": 0,
        "inaccessible_entry_count": 0,
        "hidden_entry_count": 7,
        "bundle_directory_count": 2,
        "bundle_context_file_count": 13,
        "extensions": [
          {
            "extension": ".json",
            "family": "structured-data",
            "file_count": 30,
            "total_bytes": 322518,
            "declared_v1_input_suffix": true
          },
          {
            "extension": ".jsonl",
            "family": "structured-data",
            "file_count": 6,
            "total_bytes": 431797,
            "declared_v1_input_suffix": true
          },
          {
            "extension": "[no-extension]",
            "family": "no-extension",
            "file_count": 53,
            "total_bytes": 2241259,
            "declared_v1_input_suffix": false
          }
        ],
        "families": [
          {
            "family": "no-extension",
            "file_count": 53,
            "total_bytes": 2241259
          },
          {
            "family": "structured-data",
            "file_count": 36,
            "total_bytes": 754315
          }
        ],
        "size_buckets": [
          {
            "bucket": "zero",
            "file_count": 6,
            "total_bytes": 0
          },
          {
            "bucket": "1b_to_1kib",
            "file_count": 14,
            "total_bytes": 4540
          },
          {
            "bucket": "over_1kib_to_1mib",
            "file_count": 69,
            "total_bytes": 2991034
          },
          {
            "bucket": "over_1mib_to_100mib",
            "file_count": 0,
            "total_bytes": 0
          },
          {
            "bucket": "over_100mib",
            "file_count": 0,
            "total_bytes": 0
          }
        ]
      },
      "privacy": {
        "file_content_read": false,
        "file_names_emitted": false,
        "source_paths_emitted": false,
        "content_hashes_emitted": false,
        "timestamps_emitted": false,
        "undeclared_extensions_emitted": false
      },
      "limitations": [
        "The source directory is untracked and unavailable to clean clones or CI, so this observation cannot be regenerated there.",
        "The observation describes retained Veriformis output/workspace artifacts, not original user source corpora or trainer demand.",
        "Suffix classification does not prove that a file is a user source or that parsing succeeds.",
        "Symlink targets and file content are never followed or read."
      ]
    }
  ],
  "workflow_demands": [
    {
      "demand_id": "standalone-operation",
      "state": "confirmed",
      "claim": "Core Veriformis installation, compile, validation, sealing, verification, export, workbench operation, and release gates must not require Aptus or another trainer.",
      "dimensions": {
        "workflow": "standalone-dataset-compilation",
        "output": "verified-consumer-neutral-bundle",
        "trainer_profile": null
      },
      "evidence": {
        "grade": "source-verified",
        "sources": [
          "docs/adr/0002-standalone-product-boundary.md",
          "docs/product-contract.md"
        ],
        "limitation": "This is an accepted product requirement; Phase 1 must still prove the runtime behavior."
      }
    },
    {
      "demand_id": "heterogeneous-inputs",
      "state": "confirmed",
      "claim": "Veriformis must accept heterogeneous supported source families through one local compilation workflow.",
      "dimensions": {
        "workflow": "document-source-compilation",
        "input": "heterogeneous-supported-sources",
        "trainer_profile": null
      },
      "evidence": {
        "grade": "source-verified",
        "sources": [
          "docs/product-contract.md",
          "src/veriformis/parsers/dispatch.py"
        ],
        "limitation": "Declared suffix support and repository tests do not establish real-world corpus frequency, scale, or parse quality for private corpora."
      }
    },
    {
      "demand_id": "goal-dependent-outputs",
      "state": "confirmed",
      "claim": "Training goal, semantic row schema, physical container, and consumer profile must remain separate choices so output serves the training purpose rather than an ambiguous format label.",
      "dimensions": {
        "workflow": "goal-first-dataset-preparation",
        "output": "training-ready-derived-export",